{
  "definitions": {},
  "$schema": "http://json-schema.org/draft-04/schema#",
  "type": "object",
  "properties": {
    "mdmId": {
      "type": "string"
    },
    "actualTime": {
      "type": "string"
    },
    "loyaltyPrograms": {
      "type": "array",
      "items": [
        {
          "type": "object",
          "properties": {
            "name": {
              "type": "string"
            },
            "code": {
              "type": "string"
            },
            "status": {
              "type": "string"
            },
            "options": {
              "type": "array",
              "items": [
                {
                  "type": "object",
                  "properties": {
                    "code": {
                      "type": "string"
                    },
                    "name": {
                      "type": "string"
                    },
                    "startDate": {
                      "type": "string"
                    },
                    "closeDate": {
                      "type": "string"
                    },
                    "createTime": {
                      "type": "string"
                    },
                    "operatorId": {
                      "type": "null"
                    }
                  },
                  "required": [
                    "code",
                    "name",
                    "startDate",
                    "closeDate",
                    "createTime",
                    "operatorId"
                  ]
                },
                {
                  "type": "object",
                  "properties": {
                    "code": {
                      "type": "string"
                    },
                    "name": {
                      "type": "string"
                    },
                    "startDate": {
                      "type": "string"
                    },
                    "closeDate": {
                      "type": "null"
                    },
                    "createTime": {
                      "type": "string"
                    },
                    "operatorId": {
                      "type": "null"
                    }
                  },
                  "required": [
                    "code",
                    "name",
                    "startDate",
                    "closeDate",
                    "createTime",
                    "operatorId"
                  ]
                }
              ]
            },
            "accounts": {
              "type": "array",
              "items": [
                {
                  "type": "object",
                  "properties": {
                    "currency": {
                      "type": "string"
                    },
                    "balance": {
                      "type": "integer"
                    }
                  },
                  "required": [
                    "currency",
                    "balance"
                  ]
                }
              ]
            }
          },
          "required": [
            "name",
            "code",
            "status",
            "options",
            "accounts"
          ]
        }
      ]
    },
    "eventType": {
      "type": "string"
    }
  },
  "required": [
    "mdmId",
    "actualTime",
    "loyaltyPrograms",
    "eventType"
  ]
}